{
  "run_id": "run-valid-001",
  "alias": "evidence-audit-team",
  "mode": "audit",
  "plugin_version": "1.0.0",
  "lead_decision_id": "lead-run-valid-001",
  "execution_strategy": "inline_first_selective_review",
  "nested_spawn_allowed": false,
  "spawned_review_lanes": [
    {
      "role": "citation-verifier",
      "status": "complete",
      "rationale": "tool_backed_validator checked the synthetic source identity",
      "ledger_handoff": "CL-001 checked against S-001"
    }
  ],
  "team_spawn_lanes": [],
  "spawned_agent_instances": [
    {
      "instance_id": "BMAT-SPAWN-001",
      "agent_id": "citation-verifier",
      "execution_surface": "tool_backed_validator",
      "spawn_tool": "offline-fixture",
      "thread_or_task_id": "fixture-citation-check",
      "parent_run_id": "run-valid-001",
      "status": "complete",
      "started_at": "2026-06-10T00:00:00Z",
      "completed_at": "2026-06-10T00:00:01Z",
      "input_scope": "synthetic claim CL-001 and source S-001",
      "output_artifact": "post_write_validation.json",
      "checks_run": [
        "source identity checked",
        "claim wording checked"
      ],
      "ledger_handoff": "CL-001 checked against S-001"
    }
  ],
  "stages": [
    {
      "id": "S0",
      "required": true,
      "status": "pass",
      "evidence": "runtime lock recorded"
    },
    {
      "id": "S1",
      "required": true,
      "status": "pass",
      "evidence": "source lock recorded"
    },
    {
      "id": "S3",
      "required": true,
      "status": "pass",
      "evidence": "validation passed"
    }
  ],
  "final_label": "Full protocol followed",
  "downgrade_reasons": []
}
